id,question_id,category,sub_category,weight,question,choices,not_applicable_choice
268,M_20,M,External Regulation,7,It is expected of me,"{""1"": ""Does not correspond at all"", ""2"": ""Corresponds very little"", ""3"": ""Corresponds a little"", ""4"": ""Corresponds moderately"", ""5"": ""Corresponds a bit"", ""6"": ""Corresponds a lot"", ""7"": ""Corresponds exactly""}",
269,M_21,M,Amotivation,5,I don’t really know. I truly have the impression that I’m wasting my time trying to regulate my eating behaviors,"{""1"": ""Does not correspond at all"", ""2"": ""Corresponds very little"", ""3"": ""Corresponds a little"", ""4"": ""Corresponds moderately"", ""5"": ""Corresponds a bit"", ""6"": ""Corresponds a lot"", ""7"": ""Corresponds exactly""}",
270,M_22,M,Amotivation,4,I don’t know why I bother,"{""1"": ""Does not correspond at all"", ""2"": ""Corresponds very little"", ""3"": ""Corresponds a little"", ""4"": ""Corresponds moderately"", ""5"": ""Corresponds a bit"", ""6"": ""Corresponds a lot"", ""7"": ""Corresponds exactly""}",
271,M_23,M,Amotivation,3,I can’t really see what I’m getting out of it,"{""1"": ""Does not correspond at all"", ""2"": ""Corresponds very little"", ""3"": ""Corresponds a little"", ""4"": ""Corresponds moderately"", ""5"": ""Corresponds a bit"", ""6"": ""Corresponds a lot"", ""7"": ""Corresponds exactly""}",
272,M_24,M,Amotivation,2,I don’t know. I can’t see how my efforts to eat healthy are helping my health situation,"{""1"": ""Does not correspond at all"", ""2"": ""Corresponds very little"", ""3"": ""Corresponds a little"", ""4"": ""Corresponds moderately"", ""5"": ""Corresponds a bit"", ""6"": ""Corresponds a lot"", ""7"": ""Corresponds exactly""}",
273,FQ_general_heading,FQ,"",1,Food Quantity (FQ),{},
274,FQ_general_description,FQ,"",1,This question is about the quantity of your last meal.,{},
275,FQ_1,FQ,"",1,"What was the quantity? Please specify the unit (grams, plats, cups, ...)",{},
276,FT_general_heading,FT,"",1,Food Timing (FT),{},
277,FT_general_description,FT,"",1,Those questions are about the timing of your last meal.,{},
278,FT_1,FT,"",1,When did you eat it?,{},
279,FT_2,FT,"",1,How long did you eat?,{},
163,DEB_EX_25,DEB,"",1,"If food smells and looks good, do you eat more than usual?","{""1"": ""Never"", ""2"": ""Seldom"", ""3"": ""Sometimes"", ""4"": ""Often"", ""5"": ""Very often""}",
